{
  "id": "snake-classic",
  "title": "Snake Game",
  "category": "Arcade",
  "image": "cover.svg",
  "description": "The classic Snake game where you control a snake to eat food and grow longer. Be careful not to hit the walls or yourself!",
  "controls": "Use Arrow Keys to move the snake. Eat the food to grow longer. Avoid hitting walls and your own tail.",
  "thumbnail": "cover.svg"
}